No.,Time,Source,Destination,Protocol,Length,Info
1,0,10.0.0.1,10.0.0.2,TCP,74,57222 > [SYN] Seq=0 Win=29200 Len=0 MSS=1460 SACK_PERM=1 TSval=46979 TSecr=0 WS=512
2,52.82547,10.0.0.3,10.0.0.2,TCP,74,40758 > 34568 [SYN] Seq=0 Win=29200 Len=0 MSS=1460 SACK_PERM=1 TSval=60198 TSecr=0 WS=512
3,52.980129,10.0.0.2,10.0.0.3,TCP,74,"34568 > 40758 [SYN, ACK] Seq=0 Ack=1 Win=28960 Len=0 MSS=1460 SACK_PERM=1 TSval=60224 TSecr=60198 WS=512"
4,53.030784,10.0.0.3,10.0.0.2,TCP,66,40758 > 34568 [ACK] Seq=1 Ack=1 Win=29696 Len=0 TSval=60250 TSecr=60224
5,53.048178,10.0.0.3,10.0.0.2,TCP,2114,"40758 > 34568 [PSH, ACK] Seq=1 Ack=1 Win=29696 Len=2048 TSval=60250 TSecr=60224"
6,53.060734,10.0.0.3,10.0.0.2,TCP,1514,40758 > 34568 [ACK] Seq=2049 Ack=1 Win=29696 Len=1448 TSval=60250 TSecr=60224
7,53.072517,10.0.0.3,10.0.0.2,TCP,1514,40758 > 34568 [ACK] Seq=3497 Ack=1 Win=29696 Len=1448 TSval=60250 TSecr=60224
8,53.096931,10.0.0.3,10.0.0.2,TCP,2962,40758 > 34568 [ACK] Seq=4945 Ack=1 Win=29696 Len=2896 TSval=60250 TSecr=60224
9,53.108749,10.0.0.3,10.0.0.2,TCP,1514,40758 > 34568 [ACK] Seq=7841 Ack=1 Win=29696 Len=1448 TSval=60250 TSecr=60224
10,53.133038,10.0.0.3,10.0.0.2,TCP,2962,40758 > 34568 [ACK] Seq=9289 Ack=1 Win=29696 Len=2896 TSval=60250 TSecr=60224
11,53.145084,10.0.0.3,10.0.0.2,TCP,1514,40758 > 34568 [ACK] Seq=12185 Ack=1 Win=29696 Len=1448 TSval=60250 TSecr=60224
12,53.19949,10.0.0.2,10.0.0.3,TCP,66,34568 > 40758 [ACK] Seq=1 Ack=2049 Win=33280 Len=0 TSval=60279 TSecr=60250
13,53.212089,10.0.0.2,10.0.0.3,TCP,66,34568 > 40758 [ACK] Seq=1 Ack=3497 Win=36352 Len=0 TSval=60282 TSecr=60250
14,53.224791,10.0.0.2,10.0.0.3,TCP,66,34568 > 40758 [ACK] Seq=1 Ack=4945 Win=38912 Len=0 TSval=60286 TSecr=60250
15,53.248213,10.0.0.2,10.0.0.3,TCP,66,34568 > 40758 [ACK] Seq=1 Ack=7841 Win=45056 Len=0 TSval=60291 TSecr=60250
16,53.259874,10.0.0.2,10.0.0.3,TCP,66,34568 > 40758 [ACK] Seq=1 Ack=9289 Win=47616 Len=0 TSval=60294 TSecr=60250
17,53.273842,10.0.0.3,10.0.0.2,TCP,2962,40758 > 34568 [ACK] Seq=13633 Ack=1 Win=29696 Len=2896 TSval=60305 TSecr=60279
18,53.283662,10.0.0.2,10.0.0.3,TCP,66,34568 > 40758 [ACK] Seq=1 Ack=12185 Win=53760 Len=0 TSval=60301 TSecr=60250
19,53.296028,10.0.0.2,10.0.0.3,TCP,66,34568 > 40758 [ACK] Seq=1 Ack=13633 Win=56320 Len=0 TSval=60304 TSecr=60250
20,53.298114,10.0.0.3,10.0.0.2,TCP,2962,40758 > 34568 [ACK] Seq=16529 Ack=1 Win=29696 Len=2896 TSval=60305 TSecr=60279
21,53.322407,10.0.0.3,10.0.0.2,TCP,2962,40758 > 34568 [ACK] Seq=19425 Ack=1 Win=29696 Len=2896 TSval=60308 TSecr=60282
22,53.346643,10.0.0.3,10.0.0.2,TCP,2962,40758 > 34568 [ACK] Seq=22321 Ack=1 Win=29696 Len=2896 TSval=60311 TSecr=60286
23,53.371208,10.0.0.3,10.0.0.2,TCP,2962,40758 > 34568 [ACK] Seq=25217 Ack=1 Win=29696 Len=2896 TSval=60317 TSecr=60291
24,53.395044,10.0.0.3,10.0.0.2,TCP,2962,40758 > 34568 [ACK] Seq=28113 Ack=1 Win=29696 Len=2896 TSval=60317 TSecr=60291
25,53.419486,10.0.0.3,10.0.0.2,TCP,2962,40758 > 34568 [ACK] Seq=31009 Ack=1 Win=29696 Len=2896 TSval=60320 TSecr=60294
26,53.424279,10.0.0.2,10.0.0.3,TCP,66,34568 > 40758 [ACK] Seq=1 Ack=16529 Win=62464 Len=0 TSval=60336 TSecr=60305
27,53.444293,10.0.0.3,10.0.0.2,TCP,2962,40758 > 34568 [ACK] Seq=33905 Ack=1 Win=29696 Len=2896 TSval=60326 TSecr=60301
28,53.449135,10.0.0.2,10.0.0.3,TCP,66,34568 > 40758 [ACK] Seq=1 Ack=19425 Win=68096 Len=0 TSval=60342 TSecr=60305
29,53.467641,10.0.0.3,10.0.0.2,TCP,2962,40758 > 34568 [ACK] Seq=36801 Ack=1 Win=29696 Len=2896 TSval=60326 TSecr=60301
30,53.473657,10.0.0.2,10.0.0.3,TCP,66,34568 > 40758 [ACK] Seq=1 Ack=22321 Win=73728 Len=0 TSval=60348 TSecr=60308
31,53.491894,10.0.0.3,10.0.0.2,TCP,2962,40758 > 34568 [ACK] Seq=39697 Ack=1 Win=29696 Len=2896 TSval=60329 TSecr=60304
32,53.497268,10.0.0.2,10.0.0.3,TCP,66,34568 > 40758 [ACK] Seq=1 Ack=25217 Win=79872 Len=0 TSval=60354 TSecr=60311
33,53.516584,10.0.0.3,10.0.0.2,TCP,2962,40758 > 34568 [ACK] Seq=42593 Ack=1 Win=29696 Len=2896 TSval=60361 TSecr=60336
34,53.521793,10.0.0.2,10.0.0.3,TCP,66,34568 > 40758 [ACK] Seq=1 Ack=28113 Win=85504 Len=0 TSval=60360 TSecr=60317
35,53.540332,10.0.0.3,10.0.0.2,TCP,2962,40758 > 34568 [ACK] Seq=45489 Ack=1 Win=29696 Len=2896 TSval=60361 TSecr=60336
36,53.545985,10.0.0.2,10.0.0.3,TCP,66,34568 > 40758 [ACK] Seq=1 Ack=31009 Win=91136 Len=0 TSval=60366 TSecr=60317
37,53.564698,10.0.0.3,10.0.0.2,TCP,2962,40758 > 34568 [ACK] Seq=48385 Ack=1 Win=29696 Len=2896 TSval=60367 TSecr=60342
38,53.570551,10.0.0.2,10.0.0.3,TCP,66,34568 > 40758 [ACK] Seq=1 Ack=33905 Win=96768 Len=0 TSval=60372 TSecr=60320
39,53.588878,10.0.0.3,10.0.0.2,TCP,2962,40758 > 34568 [ACK] Seq=51281 Ack=1 Win=29696 Len=2896 TSval=60367 TSecr=60342
40,53.595888,10.0.0.2,10.0.0.3,TCP,66,34568 > 40758 [ACK] Seq=1 Ack=36801 Win=102912 Len=0 TSval=60378 TSecr=60326
41,53.613291,10.0.0.3,10.0.0.2,TCP,2962,40758 > 34568 [ACK] Seq=54177 Ack=1 Win=29696 Len=2896 TSval=60373 TSecr=60348
42,53.618061,10.0.0.2,10.0.0.3,TCP,66,34568 > 40758 [ACK] Seq=1 Ack=39697 Win=108544 Len=0 TSval=60384 TSecr=60326
43,53.637577,10.0.0.3,10.0.0.2,TCP,2962,40758 > 34568 [ACK] Seq=57073 Ack=1 Win=29696 Len=2896 TSval=60373 TSecr=60348
44,53.642395,10.0.0.2,10.0.0.3,TCP,66,34568 > 40758 [ACK] Seq=1 Ack=42593 Win=114176 Len=0 TSval=60390 TSecr=60329
45,53.662018,10.0.0.3,10.0.0.2,TCP,2962,40758 > 34568 [ACK] Seq=59969 Ack=1 Win=29696 Len=2896 TSval=60379 TSecr=60354
46,53.6672,10.0.0.2,10.0.0.3,TCP,66,34568 > 40758 [ACK] Seq=1 Ack=45489 Win=120320 Len=0 TSval=60396 TSecr=60361
47,53.685617,10.0.0.3,10.0.0.2,TCP,2962,40758 > 34568 [ACK] Seq=62865 Ack=1 Win=29696 Len=2896 TSval=60379 TSecr=60354
48,53.69091,10.0.0.2,10.0.0.3,TCP,66,34568 > 40758 [ACK] Seq=1 Ack=48385 Win=125952 Len=0 TSval=60402 TSecr=60361
49,53.709856,10.0.0.3,10.0.0.2,TCP,2962,40758 > 34568 [ACK] Seq=65761 Ack=1 Win=29696 Len=2896 TSval=60385 TSecr=60360
50,53.715372,10.0.0.2,10.0.0.3,TCP,66,34568 > 40758 [ACK] Seq=1 Ack=51281 Win=131584 Len=0 TSval=60409 TSecr=60367
51,53.734209,10.0.0.3,10.0.0.2,TCP,2962,40758 > 34568 [ACK] Seq=68657 Ack=1 Win=29696 Len=2896 TSval=60385 TSecr=60360
52,53.740086,10.0.0.2,10.0.0.3,TCP,66,34568 > 40758 [ACK] Seq=1 Ack=54177 Win=137728 Len=0 TSval=60415 TSecr=60367
53,53.758653,10.0.0.3,10.0.0.2,TCP,2962,40758 > 34568 [ACK] Seq=71553 Ack=1 Win=29696 Len=2896 TSval=60391 TSecr=60366
54,53.764583,10.0.0.2,10.0.0.3,TCP,66,34568 > 40758 [ACK] Seq=1 Ack=57073 Win=143360 Len=0 TSval=60421 TSecr=60373
55,53.783038,10.0.0.3,10.0.0.2,TCP,2962,40758 > 34568 [ACK] Seq=74449 Ack=1 Win=29696 Len=2896 TSval=60391 TSecr=60366
56,53.788469,10.0.0.2,10.0.0.3,TCP,66,34568 > 40758 [ACK] Seq=1 Ack=59969 Win=148992 Len=0 TSval=60427 TSecr=60373
57,53.806733,10.0.0.3,10.0.0.2,TCP,2962,40758 > 34568 [ACK] Seq=77345 Ack=1 Win=29696 Len=2896 TSval=60397 TSecr=60372
58,53.81323,10.0.0.2,10.0.0.3,TCP,66,34568 > 40758 [ACK] Seq=1 Ack=62865 Win=155136 Len=0 TSval=60433 TSecr=60379
59,53.8311,10.0.0.3,10.0.0.2,TCP,2962,40758 > 34568 [ACK] Seq=80241 Ack=1 Win=29696 Len=2896 TSval=60397 TSecr=60372
60,53.836866,10.0.0.2,10.0.0.3,TCP,66,34568 > 40758 [ACK] Seq=1 Ack=65761 Win=160768 Len=0 TSval=60439 TSecr=60379
61,53.855394,10.0.0.3,10.0.0.2,TCP,2962,"40758 > 34568 [PSH, ACK] Seq=83137 Ack=1 Win=29696 Len=2896 TSval=60404 TSecr=60378"
62,53.86019,10.0.0.2,10.0.0.3,TCP,66,34568 > 40758 [ACK] Seq=1 Ack=68657 Win=166400 Len=0 TSval=60445 TSecr=60385
63,53.872818,10.0.0.3,10.0.0.2,TCP,2098,"40758 > 34568 [PSH, ACK] Seq=86033 Ack=1 Win=29696 Len=2032 TSval=60404 TSecr=60378"
64,53.884952,10.0.0.2,10.0.0.3,TCP,66,34568 > 40758 [ACK] Seq=1 Ack=71553 Win=170496 Len=0 TSval=60451 TSecr=60385
65,53.896768,10.0.0.3,10.0.0.2,TCP,2962,40758 > 34568 [ACK] Seq=88065 Ack=1 Win=29696 Len=2896 TSval=60409 TSecr=60384
66,53.909467,10.0.0.2,10.0.0.3,TCP,66,34568 > 40758 [ACK] Seq=1 Ack=74449 Win=170496 Len=0 TSval=60457 TSecr=60391
67,53.921202,10.0.0.3,10.0.0.2,TCP,2962,40758 > 34568 [ACK] Seq=90961 Ack=1 Win=29696 Len=2896 TSval=60409 TSecr=60384
68,53.934274,10.0.0.2,10.0.0.3,TCP,66,34568 > 40758 [ACK] Seq=1 Ack=77345 Win=170496 Len=0 TSval=60463 TSecr=60391
69,53.94553,10.0.0.3,10.0.0.2,TCP,2962,40758 > 34568 [ACK] Seq=93857 Ack=1 Win=29696 Len=2896 TSval=60415 TSecr=60390
70,53.957574,10.0.0.2,10.0.0.3,TCP,66,34568 > 40758 [ACK] Seq=1 Ack=80241 Win=170496 Len=0 TSval=60469 TSecr=60397
71,53.969765,10.0.0.3,10.0.0.2,TCP,2962,40758 > 34568 [ACK] Seq=96753 Ack=1 Win=29696 Len=2896 TSval=60422 TSecr=60396
72,53.982121,10.0.0.2,10.0.0.3,TCP,66,34568 > 40758 [ACK] Seq=1 Ack=83137 Win=170496 Len=0 TSval=60475 TSecr=60397
73,53.993625,10.0.0.3,10.0.0.2,TCP,2962,40758 > 34568 [ACK] Seq=99649 Ack=1 Win=29696 Len=2896 TSval=60427 TSecr=60402
74,54.006668,10.0.0.2,10.0.0.3,TCP,66,34568 > 40758 [ACK] Seq=1 Ack=86033 Win=170496 Len=0 TSval=60481 TSecr=60404
75,54.018231,10.0.0.3,10.0.0.2,TCP,2962,40758 > 34568 [ACK] Seq=102545 Ack=1 Win=29696 Len=2896 TSval=60434 TSecr=60409
76,54.024894,10.0.0.2,10.0.0.3,TCP,66,34568 > 40758 [ACK] Seq=1 Ack=88065 Win=170496 Len=0 TSval=60486 TSecr=60404
77,54.042552,10.0.0.3,10.0.0.2,TCP,2962,40758 > 34568 [ACK] Seq=105441 Ack=1 Win=29696 Len=2896 TSval=60440 TSecr=60415
78,54.047677,10.0.0.2,10.0.0.3,TCP,66,34568 > 40758 [ACK] Seq=1 Ack=90961 Win=170496 Len=0 TSval=60492 TSecr=60409
79,54.06711,10.0.0.3,10.0.0.2,TCP,2962,40758 > 34568 [ACK] Seq=108337 Ack=1 Win=29696 Len=2896 TSval=60446 TSecr=60421
80,54.073504,10.0.0.2,10.0.0.3,TCP,66,34568 > 40758 [ACK] Seq=1 Ack=93857 Win=170496 Len=0 TSval=60498 TSecr=60409
81,54.090583,10.0.0.3,10.0.0.2,TCP,2962,40758 > 34568 [ACK] Seq=111233 Ack=1 Win=29696 Len=2896 TSval=60452 TSecr=60427
82,54.096587,10.0.0.2,10.0.0.3,TCP,66,34568 > 40758 [ACK] Seq=1 Ack=96753 Win=170496 Len=0 TSval=60504 TSecr=60415
83,54.115082,10.0.0.3,10.0.0.2,TCP,2962,40758 > 34568 [ACK] Seq=114129 Ack=1 Win=29696 Len=2896 TSval=60458 TSecr=60433
84,54.123757,10.0.0.2,10.0.0.3,TCP,66,34568 > 40758 [ACK] Seq=1 Ack=99649 Win=170496 Len=0 TSval=60510 TSecr=60422
85,54.139321,10.0.0.3,10.0.0.2,TCP,2962,40758 > 34568 [ACK] Seq=117025 Ack=1 Win=29696 Len=2896 TSval=60464 TSecr=60439
86,54.144641,10.0.0.2,10.0.0.3,TCP,66,34568 > 40758 [ACK] Seq=1 Ack=102545 Win=170496 Len=0 TSval=60516 TSecr=60427
87,54.163261,10.0.0.3,10.0.0.2,TCP,2962,40758 > 34568 [ACK] Seq=119921 Ack=1 Win=29696 Len=2896 TSval=60470 TSecr=60445
88,54.172184,10.0.0.2,10.0.0.3,TCP,66,34568 > 40758 [ACK] Seq=1 Ack=105441 Win=176640 Len=0 TSval=60522 TSecr=60434
89,54.187475,10.0.0.3,10.0.0.2,TCP,2962,40758 > 34568 [ACK] Seq=122817 Ack=1 Win=29696 Len=2896 TSval=60476 TSecr=60451
90,54.194029,10.0.0.2,10.0.0.3,TCP,66,34568 > 40758 [ACK] Seq=1 Ack=108337 Win=180224 Len=0 TSval=60528 TSecr=60440
91,54.211671,10.0.0.3,10.0.0.2,TCP,2962,40758 > 34568 [ACK] Seq=125713 Ack=1 Win=29696 Len=2896 TSval=60476 TSecr=60451
92,54.218519,10.0.0.2,10.0.0.3,TCP,66,34568 > 40758 [ACK] Seq=1 Ack=111233 Win=180224 Len=0 TSval=60534 TSecr=60446
93,54.235907,10.0.0.3,10.0.0.2,TCP,2962,40758 > 34568 [ACK] Seq=128609 Ack=1 Win=29696 Len=2896 TSval=60482 TSecr=60457
94,54.242909,10.0.0.2,10.0.0.3,TCP,66,34568 > 40758 [ACK] Seq=1 Ack=114129 Win=180224 Len=0 TSval=60540 TSecr=60452
95,54.260482,10.0.0.3,10.0.0.2,TCP,2962,40758 > 34568 [ACK] Seq=131505 Ack=1 Win=29696 Len=2896 TSval=60488 TSecr=60463
96,54.265568,10.0.0.2,10.0.0.3,TCP,66,34568 > 40758 [ACK] Seq=1 Ack=117025 Win=180224 Len=0 TSval=60546 TSecr=60458
97,54.284882,10.0.0.3,10.0.0.2,TCP,2962,40758 > 34568 [ACK] Seq=134401 Ack=1 Win=29696 Len=2896 TSval=60494 TSecr=60469
98,54.290069,10.0.0.2,10.0.0.3,TCP,66,34568 > 40758 [ACK] Seq=1 Ack=119921 Win=180224 Len=0 TSval=60552 TSecr=60464
99,54.296732,10.0.0.3,10.0.0.2,TCP,1514,40758 > 34568 [ACK] Seq=137297 Ack=1 Win=29696 Len=1448 TSval=60500 TSecr=60475
100,54.314193,10.0.0.2,10.0.0.3,TCP,66,34568 > 40758 [ACK] Seq=1 Ack=122817 Win=180224 Len=0 TSval=60558 TSecr=60470
101,54.320873,10.0.0.3,10.0.0.2,TCP,2962,40758 > 34568 [ACK] Seq=138745 Ack=1 Win=29696 Len=2896 TSval=60506 TSecr=60481
102,54.333011,10.0.0.3,10.0.0.2,TCP,1514,40758 > 34568 [ACK] Seq=141641 Ack=1 Win=29696 Len=1448 TSval=60506 TSecr=60481
103,54.338348,10.0.0.2,10.0.0.3,TCP,66,34568 > 40758 [ACK] Seq=1 Ack=125713 Win=180224 Len=0 TSval=60564 TSecr=60476
104,54.35707,10.0.0.3,10.0.0.2,TCP,2962,40758 > 34568 [ACK] Seq=143089 Ack=1 Win=29696 Len=2896 TSval=60511 TSecr=60486
105,54.362973,10.0.0.2,10.0.0.3,TCP,66,34568 > 40758 [ACK] Seq=1 Ack=128609 Win=180224 Len=0 TSval=60570 TSecr=60476
106,54.381725,10.0.0.3,10.0.0.2,TCP,2962,40758 > 34568 [ACK] Seq=145985 Ack=1 Win=29696 Len=2896 TSval=60517 TSecr=60492
107,54.386276,10.0.0.2,10.0.0.3,TCP,66,34568 > 40758 [ACK] Seq=1 Ack=131505 Win=180224 Len=0 TSval=60576 TSecr=60482
108,54.405851,10.0.0.3,10.0.0.2,TCP,2962,40758 > 34568 [ACK] Seq=148881 Ack=1 Win=29696 Len=2896 TSval=60522 TSecr=60498
109,54.411284,10.0.0.2,10.0.0.3,TCP,66,34568 > 40758 [ACK] Seq=1 Ack=134401 Win=180224 Len=0 TSval=60582 TSecr=60488
110,54.429857,10.0.0.3,10.0.0.2,TCP,2962,40758 > 34568 [ACK] Seq=151777 Ack=1 Win=29696 Len=2896 TSval=60529 TSecr=60504
111,54.435759,10.0.0.2,10.0.0.3,TCP,66,34568 > 40758 [ACK] Seq=1 Ack=137297 Win=180224 Len=0 TSval=60588 TSecr=60494
112,54.453942,10.0.0.3,10.0.0.2,TCP,2962,40758 > 34568 [ACK] Seq=154673 Ack=1 Win=29696 Len=2896 TSval=60536 TSecr=60510
113,54.471649,10.0.0.2,10.0.0.3,TCP,66,34568 > 40758 [ACK] Seq=1 Ack=141641 Win=180224 Len=0 TSval=60597 TSecr=60500
114,54.47821,10.0.0.3,10.0.0.2,TCP,2962,40758 > 34568 [ACK] Seq=157569 Ack=1 Win=29696 Len=2896 TSval=60541 TSecr=60516
115,54.502551,10.0.0.3,10.0.0.2,TCP,2962,40758 > 34568 [ACK] Seq=160465 Ack=1 Win=29696 Len=2896 TSval=60548 TSecr=60522
116,54.508498,10.0.0.2,10.0.0.3,TCP,66,34568 > 40758 [ACK] Seq=1 Ack=145985 Win=180224 Len=0 TSval=60607 TSecr=60506
117,54.527061,10.0.0.3,10.0.0.2,TCP,2962,40758 > 34568 [ACK] Seq=163361 Ack=1 Win=29696 Len=2896 TSval=60553 TSecr=60528
118,54.533826,10.0.0.2,10.0.0.3,TCP,66,34568 > 40758 [ACK] Seq=1 Ack=148881 Win=180224 Len=0 TSval=60613 TSecr=60517
119,54.551391,10.0.0.3,10.0.0.2,TCP,2962,40758 > 34568 [ACK] Seq=166257 Ack=1 Win=29696 Len=2896 TSval=60559 TSecr=60534
120,54.556677,10.0.0.2,10.0.0.3,TCP,66,34568 > 40758 [ACK] Seq=1 Ack=151777 Win=180224 Len=0 TSval=60619 TSecr=60522
121,54.575876,10.0.0.3,10.0.0.2,TCP,2962,40758 > 34568 [ACK] Seq=169153 Ack=1 Win=29696 Len=2896 TSval=60565 TSecr=60540
122,54.580753,10.0.0.2,10.0.0.3,TCP,66,34568 > 40758 [ACK] Seq=1 Ack=154673 Win=180224 Len=0 TSval=60625 TSecr=60529
123,54.599326,10.0.0.3,10.0.0.2,TCP,2962,40758 > 34568 [ACK] Seq=172049 Ack=1 Win=29696 Len=2896 TSval=60571 TSecr=60546
124,54.605216,10.0.0.2,10.0.0.3,TCP,66,34568 > 40758 [ACK] Seq=1 Ack=157569 Win=180224 Len=0 TSval=60631 TSecr=60536
125,54.623634,10.0.0.3,10.0.0.2,TCP,2962,40758 > 34568 [ACK] Seq=174945 Ack=1 Win=29696 Len=2896 TSval=60577 TSecr=60552
126,54.629374,10.0.0.2,10.0.0.3,TCP,66,34568 > 40758 [ACK] Seq=1 Ack=160465 Win=180224 Len=0 TSval=60637 TSecr=60541
127,54.647983,10.0.0.3,10.0.0.2,TCP,2962,40758 > 34568 [ACK] Seq=177841 Ack=1 Win=29696 Len=2896 TSval=60583 TSecr=60558
128,54.653926,10.0.0.2,10.0.0.3,TCP,66,34568 > 40758 [ACK] Seq=1 Ack=163361 Win=180224 Len=0 TSval=60643 TSecr=60548
129,54.672064,10.0.0.3,10.0.0.2,TCP,2962,40758 > 34568 [ACK] Seq=180737 Ack=1 Win=29696 Len=2896 TSval=60589 TSecr=60564
130,54.67752,10.0.0.2,10.0.0.3,TCP,66,34568 > 40758 [ACK] Seq=1 Ack=166257 Win=180224 Len=0 TSval=60649 TSecr=60553
131,54.69616,10.0.0.3,10.0.0.2,TCP,2962,40758 > 34568 [ACK] Seq=183633 Ack=1 Win=29696 Len=2896 TSval=60595 TSecr=60570
132,54.701914,10.0.0.2,10.0.0.3,TCP,66,34568 > 40758 [ACK] Seq=1 Ack=169153 Win=180224 Len=0 TSval=60655 TSecr=60559
133,54.720936,10.0.0.3,10.0.0.2,TCP,2962,40758 > 34568 [ACK] Seq=186529 Ack=1 Win=29696 Len=2896 TSval=60595 TSecr=60570
134,54.72709,10.0.0.2,10.0.0.3,TCP,66,34568 > 40758 [ACK] Seq=1 Ack=172049 Win=180224 Len=0 TSval=60661 TSecr=60565
135,54.744698,10.0.0.3,10.0.0.2,TCP,2962,40758 > 34568 [ACK] Seq=189425 Ack=1 Win=29696 Len=2896 TSval=60601 TSecr=60576
136,54.750471,10.0.0.2,10.0.0.3,TCP,66,34568 > 40758 [ACK] Seq=1 Ack=174945 Win=180224 Len=0 TSval=60667 TSecr=60571
137,54.769063,10.0.0.3,10.0.0.2,TCP,2962,40758 > 34568 [ACK] Seq=192321 Ack=1 Win=29696 Len=2896 TSval=60608 TSecr=60582
138,54.775259,10.0.0.2,10.0.0.3,TCP,66,34568 > 40758 [ACK] Seq=1 Ack=177841 Win=180224 Len=0 TSval=60673 TSecr=60577
139,54.793362,10.0.0.3,10.0.0.2,TCP,2962,40758 > 34568 [ACK] Seq=195217 Ack=1 Win=29696 Len=2896 TSval=60614 TSecr=60588
140,54.798537,10.0.0.2,10.0.0.3,TCP,66,34568 > 40758 [ACK] Seq=1 Ack=180737 Win=180224 Len=0 TSval=60679 TSecr=60583
141,54.817322,10.0.0.3,10.0.0.2,TCP,2962,40758 > 34568 [ACK] Seq=198113 Ack=1 Win=29696 Len=2896 TSval=60623 TSecr=60597
142,54.822348,10.0.0.2,10.0.0.3,TCP,66,34568 > 40758 [ACK] Seq=1 Ack=183633 Win=180224 Len=0 TSval=60685 TSecr=60589
143,54.841512,10.0.0.3,10.0.0.2,TCP,2962,40758 > 34568 [ACK] Seq=201009 Ack=1 Win=29696 Len=2896 TSval=60632 TSecr=60607
144,54.847134,10.0.0.2,10.0.0.3,TCP,66,34568 > 40758 [ACK] Seq=1 Ack=186529 Win=180224 Len=0 TSval=60691 TSecr=60595
145,54.865812,10.0.0.3,10.0.0.2,TCP,2962,40758 > 34568 [ACK] Seq=203905 Ack=1 Win=29696 Len=2896 TSval=60632 TSecr=60607
146,54.872535,10.0.0.2,10.0.0.3,TCP,66,34568 > 40758 [ACK] Seq=1 Ack=189425 Win=180224 Len=0 TSval=60697 TSecr=60595
147,54.878371,10.0.0.3,10.0.0.2,TCP,1514,40758 > 34568 [ACK] Seq=206801 Ack=1 Win=29696 Len=1448 TSval=60638 TSecr=60613
148,54.895942,10.0.0.2,10.0.0.3,TCP,66,34568 > 40758 [ACK] Seq=1 Ack=192321 Win=180224 Len=0 TSval=60704 TSecr=60601
149,54.902139,10.0.0.3,10.0.0.2,TCP,2962,40758 > 34568 [ACK] Seq=208249 Ack=1 Win=29696 Len=2896 TSval=60644 TSecr=60619
150,54.920161,10.0.0.2,10.0.0.3,TCP,66,34568 > 40758 [ACK] Seq=1 Ack=195217 Win=180224 Len=0 TSval=60710 TSecr=60608
151,54.926605,10.0.0.3,10.0.0.2,TCP,2962,40758 > 34568 [ACK] Seq=211145 Ack=1 Win=29696 Len=2896 TSval=60650 TSecr=60625
152,54.944135,10.0.0.2,10.0.0.3,TCP,66,34568 > 40758 [ACK] Seq=1 Ack=198113 Win=180224 Len=0 TSval=60716 TSecr=60614
153,54.950683,10.0.0.3,10.0.0.2,TCP,2962,40758 > 34568 [ACK] Seq=214041 Ack=1 Win=29696 Len=2896 TSval=60656 TSecr=60631
154,54.967917,10.0.0.2,10.0.0.3,TCP,66,34568 > 40758 [ACK] Seq=1 Ack=201009 Win=180224 Len=0 TSval=60722 TSecr=60623
155,54.97503,10.0.0.3,10.0.0.2,TCP,2962,40758 > 34568 [ACK] Seq=216937 Ack=1 Win=29696 Len=2896 TSval=60656 TSecr=60631
156,54.992571,10.0.0.2,10.0.0.3,TCP,66,34568 > 40758 [ACK] Seq=1 Ack=203905 Win=180224 Len=0 TSval=60728 TSecr=60632
157,54.99959,10.0.0.3,10.0.0.2,TCP,2962,40758 > 34568 [ACK] Seq=219833 Ack=1 Win=29696 Len=2896 TSval=60662 TSecr=60637
158,55.016915,10.0.0.2,10.0.0.3,TCP,66,34568 > 40758 [ACK] Seq=1 Ack=206801 Win=180224 Len=0 TSval=60734 TSecr=60632
159,55.023831,10.0.0.3,10.0.0.2,TCP,2962,40758 > 34568 [ACK] Seq=222729 Ack=1 Win=29696 Len=2896 TSval=60668 TSecr=60643
160,55.047434,10.0.0.3,10.0.0.2,TCP,2962,40758 > 34568 [ACK] Seq=225625 Ack=1 Win=29696 Len=2896 TSval=60674 TSecr=60649
161,55.052677,10.0.0.2,10.0.0.3,TCP,66,34568 > 40758 [ACK] Seq=1 Ack=211145 Win=180224 Len=0 TSval=60743 TSecr=60638
162,55.071606,10.0.0.3,10.0.0.2,TCP,2962,40758 > 34568 [ACK] Seq=228521 Ack=1 Win=29696 Len=2896 TSval=60680 TSecr=60655
163,55.07702,10.0.0.2,10.0.0.3,TCP,66,34568 > 40758 [ACK] Seq=1 Ack=214041 Win=180224 Len=0 TSval=60749 TSecr=60650
164,55.096024,10.0.0.3,10.0.0.2,TCP,2962,40758 > 34568 [ACK] Seq=231417 Ack=1 Win=29696 Len=2896 TSval=60686 TSecr=60661
165,55.10182,10.0.0.2,10.0.0.3,TCP,66,34568 > 40758 [ACK] Seq=1 Ack=216937 Win=180224 Len=0 TSval=60755 TSecr=60656
166,55.120293,10.0.0.3,10.0.0.2,TCP,2962,40758 > 34568 [ACK] Seq=234313 Ack=1 Win=29696 Len=2896 TSval=60692 TSecr=60667
167,55.126662,10.0.0.2,10.0.0.3,TCP,66,34568 > 40758 [ACK] Seq=1 Ack=219833 Win=180224 Len=0 TSval=60761 TSecr=60656
168,55.144303,10.0.0.3,10.0.0.2,TCP,2962,40758 > 34568 [ACK] Seq=237209 Ack=1 Win=29696 Len=2896 TSval=60699 TSecr=60673
169,55.150959,10.0.0.2,10.0.0.3,TCP,66,34568 > 40758 [ACK] Seq=1 Ack=222729 Win=180224 Len=0 TSval=60767 TSecr=60662
170,55.168615,10.0.0.3,10.0.0.2,TCP,2962,40758 > 34568 [ACK] Seq=240105 Ack=1 Win=29696 Len=2896 TSval=60704 TSecr=60679
171,55.176096,10.0.0.2,10.0.0.3,TCP,66,34568 > 40758 [ACK] Seq=1 Ack=225625 Win=180224 Len=0 TSval=60773 TSecr=60668
172,55.192729,10.0.0.3,10.0.0.2,TCP,2962,40758 > 34568 [ACK] Seq=243001 Ack=1 Win=29696 Len=2896 TSval=60710 TSecr=60685
173,55.199511,10.0.0.2,10.0.0.3,TCP,66,34568 > 40758 [ACK] Seq=1 Ack=228521 Win=180224 Len=0 TSval=60779 TSecr=60674
174,55.217028,10.0.0.3,10.0.0.2,TCP,2962,40758 > 34568 [ACK] Seq=245897 Ack=1 Win=29696 Len=2896 TSval=60717 TSecr=60691
175,55.222253,10.0.0.2,10.0.0.3,TCP,66,34568 > 40758 [ACK] Seq=1 Ack=231417 Win=180224 Len=0 TSval=60785 TSecr=60680
176,55.24124,10.0.0.3,10.0.0.2,TCP,2962,40758 > 34568 [ACK] Seq=248793 Ack=1 Win=29696 Len=2896 TSval=60723 TSecr=60697
177,55.246656,10.0.0.2,10.0.0.3,TCP,66,34568 > 40758 [ACK] Seq=1 Ack=234313 Win=180224 Len=0 TSval=60791 TSecr=60686
178,55.265893,10.0.0.3,10.0.0.2,TCP,2962,40758 > 34568 [ACK] Seq=251689 Ack=1 Win=29696 Len=2896 TSval=60729 TSecr=60704
179,55.271054,10.0.0.2,10.0.0.3,TCP,66,34568 > 40758 [ACK] Seq=1 Ack=237209 Win=180224 Len=0 TSval=60797 TSecr=60692
180,55.290243,10.0.0.3,10.0.0.2,TCP,2962,40758 > 34568 [ACK] Seq=254585 Ack=1 Win=29696 Len=2896 TSval=60735 TSecr=60710
181,55.29517,10.0.0.2,10.0.0.3,TCP,66,34568 > 40758 [ACK] Seq=1 Ack=240105 Win=180224 Len=0 TSval=60803 TSecr=60699
182,55.31383,10.0.0.3,10.0.0.2,TCP,2962,40758 > 34568 [ACK] Seq=257481 Ack=1 Win=29696 Len=2896 TSval=60741 TSecr=60716
183,55.319461,10.0.0.2,10.0.0.3,TCP,66,34568 > 40758 [ACK] Seq=1 Ack=243001 Win=180224 Len=0 TSval=60809 TSecr=60704
184,55.338084,10.0.0.3,10.0.0.2,TCP,2962,40758 > 34568 [ACK] Seq=260377 Ack=1 Win=29696 Len=2896 TSval=60747 TSecr=60722
185,55.343919,10.0.0.2,10.0.0.3,TCP,66,34568 > 40758 [ACK] Seq=1 Ack=245897 Win=180224 Len=0 TSval=60816 TSecr=60710
186,55.362491,10.0.0.3,10.0.0.2,TCP,2962,40758 > 34568 [ACK] Seq=263273 Ack=1 Win=29696 Len=2896 TSval=60753 TSecr=60728
187,55.368357,10.0.0.2,10.0.0.3,TCP,66,34568 > 40758 [ACK] Seq=1 Ack=248793 Win=180224 Len=0 TSval=60822 TSecr=60717
188,55.386544,10.0.0.3,10.0.0.2,TCP,2962,40758 > 34568 [ACK] Seq=266169 Ack=1 Win=29696 Len=2896 TSval=60759 TSecr=60734
189,55.39171,10.0.0.2,10.0.0.3,TCP,66,34568 > 40758 [ACK] Seq=1 Ack=251689 Win=180224 Len=0 TSval=60828 TSecr=60723
190,55.411068,10.0.0.3,10.0.0.2,TCP,2962,40758 > 34568 [ACK] Seq=269065 Ack=1 Win=29696 Len=2896 TSval=60768 TSecr=60743
191,55.416927,10.0.0.2,10.0.0.3,TCP,66,34568 > 40758 [ACK] Seq=1 Ack=254585 Win=180224 Len=0 TSval=60834 TSecr=60729
192,55.435632,10.0.0.3,10.0.0.2,TCP,2962,40758 > 34568 [ACK] Seq=271961 Ack=1 Win=29696 Len=2896 TSval=60768 TSecr=60743
193,55.44178,10.0.0.2,10.0.0.3,TCP,66,34568 > 40758 [ACK] Seq=1 Ack=257481 Win=180224 Len=0 TSval=60840 TSecr=60735
194,55.45919,10.0.0.3,10.0.0.2,TCP,2962,40758 > 34568 [ACK] Seq=274857 Ack=1 Win=29696 Len=2896 TSval=60774 TSecr=60749
195,55.464954,10.0.0.2,10.0.0.3,TCP,66,34568 > 40758 [ACK] Seq=1 Ack=260377 Win=180224 Len=0 TSval=60846 TSecr=60741
196,55.483392,10.0.0.3,10.0.0.2,TCP,2962,40758 > 34568 [ACK] Seq=277753 Ack=1 Win=29696 Len=2896 TSval=60780 TSecr=60755
197,55.489298,10.0.0.2,10.0.0.3,TCP,66,34568 > 40758 [ACK] Seq=1 Ack=263273 Win=180224 Len=0 TSval=60852 TSecr=60747
198,55.50762,10.0.0.3,10.0.0.2,TCP,2962,40758 > 34568 [ACK] Seq=280649 Ack=1 Win=29696 Len=2896 TSval=60786 TSecr=60761
199,55.513152,10.0.0.2,10.0.0.3,TCP,66,34568 > 40758 [ACK] Seq=1 Ack=266169 Win=180224 Len=0 TSval=60858 TSecr=60753
200,55.5319,10.0.0.3,10.0.0.2,TCP,2962,40758 > 34568 [ACK] Seq=283545 Ack=1 Win=29696 Len=2896 TSval=60792 TSecr=60767
201,55.536794,10.0.0.2,10.0.0.3,TCP,66,34568 > 40758 [ACK] Seq=1 Ack=269065 Win=180224 Len=0 TSval=60864 TSecr=60759
202,55.556069,10.0.0.3,10.0.0.2,TCP,2962,40758 > 34568 [ACK] Seq=286441 Ack=1 Win=29696 Len=2896 TSval=60799 TSecr=60773
203,55.561572,10.0.0.2,10.0.0.3,TCP,66,34568 > 40758 [ACK] Seq=1 Ack=271961 Win=180224 Len=0 TSval=60870 TSecr=60768
204,55.580302,10.0.0.3,10.0.0.2,TCP,2962,40758 > 34568 [ACK] Seq=289337 Ack=1 Win=29696 Len=2896 TSval=60805 TSecr=60779
205,55.586938,10.0.0.2,10.0.0.3,TCP,66,34568 > 40758 [ACK] Seq=1 Ack=274857 Win=180224 Len=0 TSval=60876 TSecr=60768
206,55.592813,10.0.0.3,10.0.0.2,TCP,1514,40758 > 34568 [ACK] Seq=292233 Ack=1 Win=29696 Len=1448 TSval=60805 TSecr=60779
207,55.610359,10.0.0.2,10.0.0.3,TCP,66,34568 > 40758 [ACK] Seq=1 Ack=277753 Win=180224 Len=0 TSval=60882 TSecr=60774
208,55.61667,10.0.0.3,10.0.0.2,TCP,2962,40758 > 34568 [ACK] Seq=293681 Ack=1 Win=29696 Len=2896 TSval=60810 TSecr=60785
209,55.635,10.0.0.2,10.0.0.3,TCP,66,34568 > 40758 [ACK] Seq=1 Ack=280649 Win=180224 Len=0 TSval=60888 TSecr=60780
210,55.641596,10.0.0.3,10.0.0.2,TCP,2962,40758 > 34568 [ACK] Seq=296577 Ack=1 Win=29696 Len=2896 TSval=60816 TSecr=60791
211,55.658463,10.0.0.2,10.0.0.3,TCP,66,34568 > 40758 [ACK] Seq=1 Ack=283545 Win=180224 Len=0 TSval=60894 TSecr=60786
212,55.6651,10.0.0.3,10.0.0.2,TCP,2962,40758 > 34568 [ACK] Seq=299473 Ack=1 Win=29696 Len=2896 TSval=60822 TSecr=60797
213,55.682581,10.0.0.2,10.0.0.3,TCP,66,34568 > 40758 [ACK] Seq=1 Ack=286441 Win=180224 Len=0 TSval=60900 TSecr=60792
214,55.690291,10.0.0.3,10.0.0.2,TCP,2962,40758 > 34568 [ACK] Seq=302369 Ack=1 Win=29696 Len=2896 TSval=60829 TSecr=60803
215,55.706768,10.0.0.2,10.0.0.3,TCP,66,34568 > 40758 [ACK] Seq=1 Ack=289337 Win=180224 Len=0 TSval=60906 TSecr=60799
216,55.713845,10.0.0.3,10.0.0.2,TCP,2962,40758 > 34568 [ACK] Seq=305265 Ack=1 Win=29696 Len=2896 TSval=60835 TSecr=60809
217,55.725631,10.0.0.3,10.0.0.2,TCP,1514,40758 > 34568 [ACK] Seq=308161 Ack=1 Win=29696 Len=1448 TSval=60835 TSecr=60809
218,55.731417,10.0.0.2,10.0.0.3,TCP,66,34568 > 40758 [ACK] Seq=1 Ack=292233 Win=180224 Len=0 TSval=60912 TSecr=60805
219,55.749981,10.0.0.3,10.0.0.2,TCP,2962,40758 > 34568 [ACK] Seq=309609 Ack=1 Win=29696 Len=2896 TSval=60841 TSecr=60816
220,55.767625,10.0.0.2,10.0.0.3,TCP,66,34568 > 40758 [ACK] Seq=1 Ack=296577 Win=180224 Len=0 TSval=60921 TSecr=60805
221,55.774341,10.0.0.3,10.0.0.2,TCP,2962,[TCP Previous segment not captured] 40758 > 34568 [ACK] Seq=315401 Ack=1 Win=29696 Len=2896 TSval=60853 TSecr=60828
222,55.792521,10.0.0.2,10.0.0.3,TCP,66,34568 > 40758 [ACK] Seq=1 Ack=299473 Win=180224 Len=0 TSval=60928 TSecr=60816
223,55.798828,10.0.0.3,10.0.0.2,TCP,2962,40758 > 34568 [ACK] Seq=318297 Ack=1 Win=29696 Len=2896 TSval=60859 TSecr=60834
224,55.815899,10.0.0.2,10.0.0.3,TCP,66,34568 > 40758 [ACK] Seq=1 Ack=302369 Win=180224 Len=0 TSval=60934 TSecr=60822
225,55.822529,10.0.0.3,10.0.0.2,TCP,2962,40758 > 34568 [ACK] Seq=321193 Ack=1 Win=29696 Len=2896 TSval=60865 TSecr=60840
226,55.841945,10.0.0.2,10.0.0.3,TCP,66,34568 > 40758 [ACK] Seq=1 Ack=305265 Win=180224 Len=0 TSval=60940 TSecr=60829
227,55.846846,10.0.0.3,10.0.0.2,TCP,2962,40758 > 34568 [ACK] Seq=324089 Ack=1 Win=29696 Len=2896 TSval=60871 TSecr=60846
228,55.8661,10.0.0.2,10.0.0.3,TCP,66,34568 > 40758 [ACK] Seq=1 Ack=308161 Win=180224 Len=0 TSval=60946 TSecr=60835
229,55.871087,10.0.0.3,10.0.0.2,TCP,2962,40758 > 34568 [ACK] Seq=326985 Ack=1 Win=29696 Len=2896 TSval=60877 TSecr=60852
230,55.895368,10.0.0.3,10.0.0.2,TCP,2962,40758 > 34568 [ACK] Seq=329881 Ack=1 Win=29696 Len=2896 TSval=60883 TSecr=60858
231,55.900402,10.0.0.2,10.0.0.3,TCP,66,34568 > 40758 [ACK] Seq=1 Ack=312505 Win=180224 Len=0 TSval=60955 TSecr=60835
232,55.919586,10.0.0.3,10.0.0.2,TCP,2962,40758 > 34568 [ACK] Seq=332777 Ack=1 Win=29696 Len=2896 TSval=60889 TSecr=60864
233,55.926054,10.0.0.2,10.0.0.3,TCP,78,[TCP Dup ACK 231#1] 34568 > 40758 [ACK] Seq=1 Ack=312505 Win=180224 Len=0 TSval=60961 TSecr=60835 SLE=315401 SRE=318297
234,55.944036,10.0.0.3,10.0.0.2,TCP,2962,40758 > 34568 [ACK] Seq=335673 Ack=1 Win=29696 Len=2896 TSval=60895 TSecr=60870
235,55.950302,10.0.0.2,10.0.0.3,TCP,78,[TCP Dup ACK 231#2] 34568 > 40758 [ACK] Seq=1 Ack=312505 Win=180224 Len=0 TSval=60967 TSecr=60835 SLE=315401 SRE=321193
236,55.967867,10.0.0.3,10.0.0.2,TCP,2962,40758 > 34568 [ACK] Seq=338569 Ack=1 Win=29696 Len=2896 TSval=60901 TSecr=60876
237,55.973342,10.0.0.2,10.0.0.3,TCP,78,[TCP Dup ACK 231#3] 34568 > 40758 [ACK] Seq=1 Ack=312505 Win=180224 Len=0 TSval=60973 TSecr=60835 SLE=315401 SRE=324089
238,55.992932,10.0.0.3,10.0.0.2,TCP,2962,40758 > 34568 [ACK] Seq=341465 Ack=1 Win=29696 Len=2896 TSval=60907 TSecr=60882
239,55.998262,10.0.0.2,10.0.0.3,TCP,78,[TCP Dup ACK 231#4] 34568 > 40758 [ACK] Seq=1 Ack=312505 Win=180224 Len=0 TSval=60979 TSecr=60835 SLE=315401 SRE=326985
240,56.016441,10.0.0.3,10.0.0.2,TCP,2962,40758 > 34568 [ACK] Seq=344361 Ack=1 Win=29696 Len=2896 TSval=60913 TSecr=60888
241,56.021636,10.0.0.2,10.0.0.3,TCP,78,[TCP Dup ACK 231#5] 34568 > 40758 [ACK] Seq=1 Ack=312505 Win=180224 Len=0 TSval=60985 TSecr=60835 SLE=315401 SRE=329881
242,56.040822,10.0.0.3,10.0.0.2,TCP,2962,40758 > 34568 [ACK] Seq=347257 Ack=1 Win=29696 Len=2896 TSval=60919 TSecr=60894
243,56.046347,10.0.0.2,10.0.0.3,TCP,78,[TCP Dup ACK 231#6] 34568 > 40758 [ACK] Seq=1 Ack=312505 Win=180224 Len=0 TSval=60991 TSecr=60835 SLE=315401 SRE=332777
244,56.064774,10.0.0.3,10.0.0.2,TCP,2962,40758 > 34568 [ACK] Seq=350153 Ack=1 Win=29696 Len=2896 TSval=60925 TSecr=60900
245,56.070333,10.0.0.2,10.0.0.3,TCP,78,[TCP Dup ACK 231#7] 34568 > 40758 [ACK] Seq=1 Ack=312505 Win=180224 Len=0 TSval=60997 TSecr=60835 SLE=315401 SRE=335673
246,56.089569,10.0.0.3,10.0.0.2,TCP,2962,40758 > 34568 [ACK] Seq=353049 Ack=1 Win=29696 Len=2896 TSval=60931 TSecr=60906
247,56.094433,10.0.0.2,10.0.0.3,TCP,78,[TCP Dup ACK 231#8] 34568 > 40758 [ACK] Seq=1 Ack=312505 Win=180224 Len=0 TSval=61003 TSecr=60835 SLE=315401 SRE=338569
248,56.113959,10.0.0.3,10.0.0.2,TCP,2962,40758 > 34568 [ACK] Seq=355945 Ack=1 Win=29696 Len=2896 TSval=60938 TSecr=60912
249,56.11889,10.0.0.2,10.0.0.3,TCP,78,[TCP Dup ACK 231#9] 34568 > 40758 [ACK] Seq=1 Ack=312505 Win=180224 Len=0 TSval=61009 TSecr=60835 SLE=315401 SRE=341465
250,56.137507,10.0.0.3,10.0.0.2,TCP,2962,40758 > 34568 [ACK] Seq=358841 Ack=1 Win=29696 Len=2896 TSval=60947 TSecr=60921
251,56.144569,10.0.0.2,10.0.0.3,TCP,78,[TCP Dup ACK 231#10] 34568 > 40758 [ACK] Seq=1 Ack=312505 Win=180224 Len=0 TSval=61016 TSecr=60835 SLE=315401 SRE=344361
252,56.16181,10.0.0.3,10.0.0.2,TCP,2962,40758 > 34568 [ACK] Seq=361737 Ack=1 Win=29696 Len=2896 TSval=60953 TSecr=60928
253,56.167668,10.0.0.2,10.0.0.3,TCP,78,[TCP Dup ACK 231#11] 34568 > 40758 [ACK] Seq=1 Ack=312505 Win=180224 Len=0 TSval=61021 TSecr=60835 SLE=315401 SRE=347257
254,56.18622,10.0.0.3,10.0.0.2,TCP,2962,40758 > 34568 [ACK] Seq=364633 Ack=1 Win=29696 Len=2896 TSval=60959 TSecr=60934
255,56.192041,10.0.0.2,10.0.0.3,TCP,78,[TCP Dup ACK 231#12] 34568 > 40758 [ACK] Seq=1 Ack=312505 Win=180224 Len=0 TSval=61028 TSecr=60835 SLE=315401 SRE=350153
256,56.210617,10.0.0.3,10.0.0.2,TCP,2962,40758 > 34568 [ACK] Seq=367529 Ack=1 Win=29696 Len=2896 TSval=60965 TSecr=60940
257,56.215427,10.0.0.2,10.0.0.3,TCP,78,[TCP Dup ACK 231#13] 34568 > 40758 [ACK] Seq=1 Ack=312505 Win=180224 Len=0 TSval=61033 TSecr=60835 SLE=315401 SRE=353049
258,56.234387,10.0.0.3,10.0.0.2,TCP,2962,40758 > 34568 [ACK] Seq=370425 Ack=1 Win=29696 Len=2896 TSval=60971 TSecr=60946
259,56.240845,10.0.0.2,10.0.0.3,TCP,78,[TCP Dup ACK 231#14] 34568 > 40758 [ACK] Seq=1 Ack=312505 Win=180224 Len=0 TSval=61040 TSecr=60835 SLE=315401 SRE=355945
260,56.24673,10.0.0.3,10.0.0.2,TCP,1514,40758 > 34568 [ACK] Seq=373321 Ack=1 Win=29696 Len=1448 TSval=60971 TSecr=60946
261,56.265554,10.0.0.2,10.0.0.3,TCP,78,[TCP Dup ACK 231#15] 34568 > 40758 [ACK] Seq=1 Ack=312505 Win=180224 Len=0 TSval=61046 TSecr=60835 SLE=315401 SRE=358841
262,56.271105,10.0.0.3,10.0.0.2,TCP,2962,40758 > 34568 [ACK] Seq=374769 Ack=1 Win=29696 Len=2896 TSval=60980 TSecr=60955
263,56.282813,10.0.0.3,10.0.0.2,TCP,1514,[TCP Fast Retransmission] 40758 > 34568 [ACK] Seq=312505 Ack=1 Win=29696 Len=1448 TSval=60986 TSecr=60961
264,56.288065,10.0.0.2,10.0.0.3,TCP,78,[TCP Dup ACK 231#16] 34568 > 40758 [ACK] Seq=1 Ack=312505 Win=180224 Len=0 TSval=61052 TSecr=60835 SLE=315401 SRE=361737
265,56.294883,10.0.0.3,10.0.0.2,TCP,1514,40758 > 34568 [ACK] Seq=377665 Ack=1 Win=29696 Len=1448 TSval=60986 TSecr=60961
266,56.307065,10.0.0.3,10.0.0.2,TCP,1514,[TCP Retransmission] 40758 > 34568 [ACK] Seq=313953 Ack=1 Win=29696 Len=1448 TSval=60992 TSecr=60967
267,56.312762,10.0.0.2,10.0.0.3,TCP,78,[TCP Dup ACK 231#17] 34568 > 40758 [ACK] Seq=1 Ack=312505 Win=180224 Len=0 TSval=61058 TSecr=60835 SLE=315401 SRE=364633
268,56.331267,10.0.0.3,10.0.0.2,TCP,2962,40758 > 34568 [ACK] Seq=379113 Ack=1 Win=29696 Len=2896 TSval=60998 TSecr=60973
269,56.336812,10.0.0.2,10.0.0.3,TCP,78,[TCP Dup ACK 231#18] 34568 > 40758 [ACK] Seq=1 Ack=312505 Win=180224 Len=0 TSval=61064 TSecr=60835 SLE=315401 SRE=367529
270,56.343367,10.0.0.3,10.0.0.2,TCP,1514,40758 > 34568 [ACK] Seq=382009 Ack=1 Win=29696 Len=1448 TSval=61004 TSecr=60979
271,56.355452,10.0.0.3,10.0.0.2,TCP,1514,40758 > 34568 [ACK] Seq=383457 Ack=1 Win=29696 Len=1448 TSval=61010 TSecr=60985
272,56.361843,10.0.0.2,10.0.0.3,TCP,78,[TCP Dup ACK 231#19] 34568 > 40758 [ACK] Seq=1 Ack=312505 Win=180224 Len=0 TSval=61070 TSecr=60835 SLE=315401 SRE=370425
273,56.379697,10.0.0.3,10.0.0.2,TCP,2962,40758 > 34568 [ACK] Seq=384905 Ack=1 Win=29696 Len=2896 TSval=61016 TSecr=60991
274,56.384902,10.0.0.2,10.0.0.3,TCP,78,[TCP Dup ACK 231#20] 34568 > 40758 [ACK] Seq=1 Ack=312505 Win=180224 Len=0 TSval=61076 TSecr=60835 SLE=315401 SRE=373321
275,56.391818,10.0.0.3,10.0.0.2,TCP,1514,40758 > 34568 [ACK] Seq=387801 Ack=1 Win=29696 Len=1448 TSval=61022 TSecr=60997
276,56.398909,10.0.0.2,10.0.0.3,TCP,78,[TCP Dup ACK 231#21] 34568 > 40758 [ACK] Seq=1 Ack=312505 Win=180224 Len=0 TSval=61079 TSecr=60835 SLE=315401 SRE=374769
277,56.4162,10.0.0.3,10.0.0.2,TCP,2962,40758 > 34568 [ACK] Seq=389249 Ack=1 Win=29696 Len=2896 TSval=61028 TSecr=61003
278,56.422261,10.0.0.2,10.0.0.3,TCP,78,[TCP Dup ACK 231#22] 34568 > 40758 [ACK] Seq=1 Ack=312505 Win=180224 Len=0 TSval=61085 TSecr=60835 SLE=315401 SRE=377665
279,56.428129,10.0.0.3,10.0.0.2,TCP,1514,40758 > 34568 [ACK] Seq=392145 Ack=1 Win=29696 Len=1448 TSval=61034 TSecr=61009
280,56.434646,10.0.0.2,10.0.0.3,TCP,78,34568 > 40758 [ACK] Seq=1 Ack=313953 Win=180224 Len=0 TSval=61088 TSecr=60986 SLE=315401 SRE=377665
281,56.440569,10.0.0.3,10.0.0.2,TCP,1514,40758 > 34568 [ACK] Seq=393593 Ack=1 Win=29696 Len=1448 TSval=61041 TSecr=61016
282,56.447042,10.0.0.2,10.0.0.3,TCP,78,[TCP Dup ACK 280#1] 34568 > 40758 [ACK] Seq=1 Ack=313953 Win=180224 Len=0 TSval=61091 TSecr=60986 SLE=315401 SRE=379113
283,56.459476,10.0.0.2,10.0.0.3,TCP,66,34568 > 40758 [ACK] Seq=1 Ack=379113 Win=180224 Len=0 TSval=61094 TSecr=60992
284,56.464504,10.0.0.3,10.0.0.2,TCP,2962,40758 > 34568 [ACK] Seq=395041 Ack=1 Win=29696 Len=2896 TSval=61047 TSecr=61021
285,56.476641,10.0.0.3,10.0.0.2,TCP,1514,40758 > 34568 [ACK] Seq=397937 Ack=1 Win=29696 Len=1448 TSval=61053 TSecr=61028
286,56.482907,10.0.0.2,10.0.0.3,TCP,66,34568 > 40758 [ACK] Seq=1 Ack=382009 Win=180224 Len=0 TSval=61100 TSecr=60998
287,56.495639,10.0.0.2,10.0.0.3,TCP,66,34568 > 40758 [ACK] Seq=1 Ack=383457 Win=180224 Len=0 TSval=61103 TSecr=61004
288,56.501537,10.0.0.3,10.0.0.2,TCP,2962,40758 > 34568 [ACK] Seq=399385 Ack=1 Win=29696 Len=2896 TSval=61059 TSecr=61033
289,56.50725,10.0.0.2,10.0.0.3,TCP,66,34568 > 40758 [ACK] Seq=1 Ack=384905 Win=180224 Len=0 TSval=61106 TSecr=61010
290,56.513212,10.0.0.3,10.0.0.2,TCP,1514,40758 > 34568 [ACK] Seq=402281 Ack=1 Win=29696 Len=1448 TSval=61065 TSecr=61040
291,56.525101,10.0.0.3,10.0.0.2,TCP,1514,40758 > 34568 [ACK] Seq=403729 Ack=1 Win=29696 Len=1448 TSval=61071 TSecr=61046
292,56.533116,10.0.0.2,10.0.0.3,TCP,66,34568 > 40758 [ACK] Seq=1 Ack=387801 Win=180224 Len=0 TSval=61112 TSecr=61016
293,56.543783,10.0.0.2,10.0.0.3,TCP,66,34568 > 40758 [ACK] Seq=1 Ack=389249 Win=180224 Len=0 TSval=61116 TSecr=61022
294,56.54924,10.0.0.3,10.0.0.2,TCP,2962,40758 > 34568 [ACK] Seq=405177 Ack=1 Win=29696 Len=2896 TSval=61083 TSecr=61058
295,56.566902,10.0.0.2,10.0.0.3,TCP,66,34568 > 40758 [ACK] Seq=1 Ack=392145 Win=180224 Len=0 TSval=61121 TSecr=61028
296,56.57369,10.0.0.3,10.0.0.2,TCP,2962,40758 > 34568 [ACK] Seq=408073 Ack=1 Win=29696 Len=2896 TSval=61089 TSecr=61064
297,56.579882,10.0.0.2,10.0.0.3,TCP,66,34568 > 40758 [ACK] Seq=1 Ack=393593 Win=180224 Len=0 TSval=61125 TSecr=61034
298,56.592249,10.0.0.2,10.0.0.3,TCP,66,34568 > 40758 [ACK] Seq=1 Ack=395041 Win=180224 Len=0 TSval=61128 TSecr=61041
299,56.598072,10.0.0.3,10.0.0.2,TCP,2962,40758 > 34568 [ACK] Seq=410969 Ack=1 Win=29696 Len=2896 TSval=61095 TSecr=61070
300,56.615622,10.0.0.2,10.0.0.3,TCP,66,34568 > 40758 [ACK] Seq=1 Ack=397937 Win=180224 Len=0 TSval=61134 TSecr=61047
301,56.621935,10.0.0.3,10.0.0.2,TCP,2962,40758 > 34568 [ACK] Seq=413865 Ack=1 Win=29696 Len=2896 TSval=61101 TSecr=61076
302,56.628319,10.0.0.2,10.0.0.3,TCP,66,34568 > 40758 [ACK] Seq=1 Ack=399385 Win=180224 Len=0 TSval=61137 TSecr=61053
303,56.634221,10.0.0.3,10.0.0.2,TCP,1514,40758 > 34568 [ACK] Seq=416761 Ack=1 Win=29696 Len=1448 TSval=61104 TSecr=61079
304,56.651849,10.0.0.2,10.0.0.3,TCP,66,34568 > 40758 [ACK] Seq=1 Ack=402281 Win=180224 Len=0 TSval=61143 TSecr=61059
305,56.658566,10.0.0.3,10.0.0.2,TCP,2962,40758 > 34568 [ACK] Seq=418209 Ack=1 Win=29696 Len=2896 TSval=61110 TSecr=61085
306,56.665741,10.0.0.2,10.0.0.3,TCP,66,34568 > 40758 [ACK] Seq=1 Ack=403729 Win=180224 Len=0 TSval=61146 TSecr=61065
307,56.670362,10.0.0.3,10.0.0.2,TCP,1514,40758 > 34568 [ACK] Seq=421105 Ack=1 Win=29696 Len=1448 TSval=61113 TSecr=61088
308,56.676886,10.0.0.2,10.0.0.3,TCP,66,34568 > 40758 [ACK] Seq=1 Ack=405177 Win=180224 Len=0 TSval=61149 TSecr=61071
309,56.682982,10.0.0.3,10.0.0.2,TCP,1514,40758 > 34568 [ACK] Seq=422553 Ack=1 Win=29696 Len=1448 TSval=61116 TSecr=61091
310,56.694694,10.0.0.3,10.0.0.2,TCP,1514,40758 > 34568 [ACK] Seq=424001 Ack=1 Win=29696 Len=1448 TSval=61120 TSecr=61094
311,56.700529,10.0.0.2,10.0.0.3,TCP,66,34568 > 40758 [ACK] Seq=1 Ack=408073 Win=180224 Len=0 TSval=61155 TSecr=61083
312,56.719033,10.0.0.3,10.0.0.2,TCP,2962,40758 > 34568 [ACK] Seq=425449 Ack=1 Win=29696 Len=2896 TSval=61125 TSecr=61100
313,56.724382,10.0.0.2,10.0.0.3,TCP,66,34568 > 40758 [ACK] Seq=1 Ack=410969 Win=180224 Len=0 TSval=61161 TSecr=61089
314,56.74355,10.0.0.3,10.0.0.2,TCP,2962,40758 > 34568 [ACK] Seq=428345 Ack=1 Win=29696 Len=2896 TSval=61129 TSecr=61103
315,56.748361,10.0.0.2,10.0.0.3,TCP,66,34568 > 40758 [ACK] Seq=1 Ack=413865 Win=180224 Len=0 TSval=61167 TSecr=61095
316,56.755219,10.0.0.3,10.0.0.2,TCP,1514,40758 > 34568 [ACK] Seq=431241 Ack=1 Win=29696 Len=1448 TSval=61132 TSecr=61106
317,56.77277,10.0.0.2,10.0.0.3,TCP,66,34568 > 40758 [ACK] Seq=1 Ack=416761 Win=180224 Len=0 TSval=61173 TSecr=61101
318,56.779535,10.0.0.3,10.0.0.2,TCP,2962,40758 > 34568 [ACK] Seq=432689 Ack=1 Win=29696 Len=2896 TSval=61138 TSecr=61112
319,56.791516,10.0.0.3,10.0.0.2,TCP,1514,40758 > 34568 [ACK] Seq=435585 Ack=1 Win=29696 Len=1448 TSval=61141 TSecr=61116
320,56.810161,10.0.0.2,10.0.0.3,TCP,66,34568 > 40758 [ACK] Seq=1 Ack=421105 Win=180224 Len=0 TSval=61182 TSecr=61104
321,56.815721,10.0.0.3,10.0.0.2,TCP,2962,40758 > 34568 [ACK] Seq=437033 Ack=1 Win=29696 Len=2896 TSval=61146 TSecr=61121
322,56.834181,10.0.0.2,10.0.0.3,TCP,66,34568 > 40758 [ACK] Seq=1 Ack=424001 Win=180224 Len=0 TSval=61188 TSecr=61113
323,56.840114,10.0.0.3,10.0.0.2,TCP,2962,40758 > 34568 [ACK] Seq=439929 Ack=1 Win=29696 Len=2896 TSval=61150 TSecr=61125
324,56.852122,10.0.0.3,10.0.0.2,TCP,1514,40758 > 34568 [ACK] Seq=442825 Ack=1 Win=29696 Len=1448 TSval=61153 TSecr=61128
325,56.869359,10.0.0.2,10.0.0.3,TCP,66,34568 > 40758 [ACK] Seq=1 Ack=428345 Win=185856 Len=0 TSval=61197 TSecr=61120
326,56.876387,10.0.0.3,10.0.0.2,TCP,2962,40758 > 34568 [ACK] Seq=444273 Ack=1 Win=29696 Len=2896 TSval=61159 TSecr=61134
327,56.888411,10.0.0.3,10.0.0.2,TCP,1514,40758 > 34568 [ACK] Seq=447169 Ack=1 Win=29696 Len=1448 TSval=61162 TSecr=61137
328,56.893854,10.0.0.2,10.0.0.3,TCP,66,34568 > 40758 [ACK] Seq=1 Ack=431241 Win=191488 Len=0 TSval=61203 TSecr=61129
329,56.906673,10.0.0.2,10.0.0.3,TCP,66,34568 > 40758 [ACK] Seq=1 Ack=432689 Win=194560 Len=0 TSval=61206 TSecr=61132
330,56.913328,10.0.0.3,10.0.0.2,TCP,2962,40758 > 34568 [ACK] Seq=448617 Ack=1 Win=29696 Len=2896 TSval=61168 TSecr=61143
331,56.930714,10.0.0.2,10.0.0.3,TCP,66,34568 > 40758 [ACK] Seq=1 Ack=435585 Win=200192 Len=0 TSval=61212 TSecr=61138
332,56.937584,10.0.0.3,10.0.0.2,TCP,2962,40758 > 34568 [ACK] Seq=451513 Ack=1 Win=29696 Len=2896 TSval=61171 TSecr=61146
333,56.943468,10.0.0.2,10.0.0.3,TCP,66,34568 > 40758 [ACK] Seq=1 Ack=437033 Win=203264 Len=0 TSval=61215 TSecr=61141
334,56.949591,10.0.0.3,10.0.0.2,TCP,1514,40758 > 34568 [ACK] Seq=454409 Ack=1 Win=29696 Len=1448 TSval=61174 TSecr=61149
335,56.970524,10.0.0.2,10.0.0.3,TCP,66,34568 > 40758 [ACK] Seq=1 Ack=439929 Win=208896 Len=0 TSval=61221 TSecr=61146
336,56.973875,10.0.0.3,10.0.0.2,TCP,2962,40758 > 34568 [ACK] Seq=455857 Ack=1 Win=29696 Len=2896 TSval=61180 TSecr=61155
337,56.990601,10.0.0.2,10.0.0.3,TCP,66,34568 > 40758 [ACK] Seq=1 Ack=442825 Win=215040 Len=0 TSval=61227 TSecr=61150
338,56.997514,10.0.0.3,10.0.0.2,TCP,2962,40758 > 34568 [ACK] Seq=458753 Ack=1 Win=29696 Len=2896 TSval=61186 TSecr=61161
339,57.004157,10.0.0.2,10.0.0.3,TCP,66,34568 > 40758 [ACK] Seq=1 Ack=444273 Win=217600 Len=0 TSval=61231 TSecr=61153
340,57.021704,10.0.0.3,10.0.0.2,TCP,2962,40758 > 34568 [ACK] Seq=461649 Ack=1 Win=29696 Len=2896 TSval=61192 TSecr=61167
341,57.027076,10.0.0.2,10.0.0.3,TCP,66,34568 > 40758 [ACK] Seq=1 Ack=447169 Win=223744 Len=0 TSval=61236 TSecr=61159
342,57.040172,10.0.0.2,10.0.0.3,TCP,66,34568 > 40758 [ACK] Seq=1 Ack=448617 Win=226304 Len=0 TSval=61240 TSecr=61162
343,57.046128,10.0.0.3,10.0.0.2,TCP,2962,40758 > 34568 [ACK] Seq=464545 Ack=1 Win=29696 Len=2896 TSval=61198 TSecr=61173
344,57.070495,10.0.0.3,10.0.0.2,TCP,2962,40758 > 34568 [ACK] Seq=467441 Ack=1 Win=29696 Len=2896 TSval=61207 TSecr=61182
345,57.070812,10.0.0.2,10.0.0.3,TCP,66,34568 > 40758 [ACK] Seq=1 Ack=451513 Win=232448 Len=0 TSval=61247 TSecr=61168
346,57.087928,10.0.0.2,10.0.0.3,TCP,66,34568 > 40758 [ACK] Seq=1 Ack=454409 Win=238080 Len=0 TSval=61252 TSecr=61171
347,57.094851,10.0.0.3,10.0.0.2,TCP,2962,40758 > 34568 [ACK] Seq=470337 Ack=1 Win=29696 Len=2896 TSval=61207 TSecr=61182
348,57.106977,10.0.0.2,10.0.0.3,TCP,66,34568 > 40758 [ACK] Seq=1 Ack=455857 Win=241152 Len=0 TSval=61256 TSecr=61174
349,57.119237,10.0.0.3,10.0.0.2,TCP,2962,40758 > 34568 [ACK] Seq=473233 Ack=1 Win=29696 Len=2896 TSval=61213 TSecr=61188
350,57.124133,10.0.0.2,10.0.0.3,TCP,66,34568 > 40758 [ACK] Seq=1 Ack=458753 Win=246784 Len=0 TSval=61261 TSecr=61180
351,57.143617,10.0.0.3,10.0.0.2,TCP,2962,40758 > 34568 [ACK] Seq=476129 Ack=1 Win=29696 Len=2896 TSval=61222 TSecr=61197
352,57.149533,10.0.0.2,10.0.0.3,TCP,66,34568 > 40758 [ACK] Seq=1 Ack=461649 Win=252416 Len=0 TSval=61267 TSecr=61186
353,57.167067,10.0.0.3,10.0.0.2,TCP,2962,40758 > 34568 [ACK] Seq=479025 Ack=1 Win=29696 Len=2896 TSval=61222 TSecr=61197
354,57.172316,10.0.0.2,10.0.0.3,TCP,66,34568 > 40758 [ACK] Seq=1 Ack=464545 Win=258048 Len=0 TSval=61273 TSecr=61192
355,57.191486,10.0.0.3,10.0.0.2,TCP,2962,40758 > 34568 [ACK] Seq=481921 Ack=1 Win=29696 Len=2896 TSval=61228 TSecr=61203
356,57.197646,10.0.0.2,10.0.0.3,TCP,66,34568 > 40758 [ACK] Seq=1 Ack=467441 Win=264192 Len=0 TSval=61279 TSecr=61198
357,57.203375,10.0.0.3,10.0.0.2,TCP,1514,40758 > 34568 [ACK] Seq=484817 Ack=1 Win=29696 Len=1448 TSval=61231 TSecr=61206
358,57.220833,10.0.0.2,10.0.0.3,TCP,66,34568 > 40758 [ACK] Seq=1 Ack=470337 Win=269824 Len=0 TSval=61285 TSecr=61207
359,57.227534,10.0.0.3,10.0.0.2,TCP,2962,40758 > 34568 [ACK] Seq=486265 Ack=1 Win=29696 Len=2896 TSval=61237 TSecr=61212
360,57.240331,10.0.0.3,10.0.0.2,TCP,1514,40758 > 34568 [ACK] Seq=489161 Ack=1 Win=29696 Len=1448 TSval=61241 TSecr=61215
361,57.246144,10.0.0.2,10.0.0.3,TCP,66,34568 > 40758 [ACK] Seq=1 Ack=473233 Win=275456 Len=0 TSval=61291 TSecr=61207
362,57.263859,10.0.0.3,10.0.0.2,TCP,2962,40758 > 34568 [ACK] Seq=490609 Ack=1 Win=29696 Len=2896 TSval=61247 TSecr=61221
363,57.270822,10.0.0.2,10.0.0.3,TCP,66,34568 > 40758 [ACK] Seq=1 Ack=476129 Win=281600 Len=0 TSval=61297 TSecr=61213
364,57.288134,10.0.0.3,10.0.0.2,TCP,2962,40758 > 34568 [ACK] Seq=493505 Ack=1 Win=29696 Len=2896 TSval=61252 TSecr=61227
365,57.294953,10.0.0.2,10.0.0.3,TCP,66,34568 > 40758 [ACK] Seq=1 Ack=479025 Win=287232 Len=0 TSval=61303 TSecr=61222
366,57.312324,10.0.0.3,10.0.0.2,TCP,2962,40758 > 34568 [ACK] Seq=496401 Ack=1 Win=29696 Len=2896 TSval=61256 TSecr=61231
367,57.318436,10.0.0.2,10.0.0.3,TCP,66,34568 > 40758 [ACK] Seq=1 Ack=481921 Win=292864 Len=0 TSval=61309 TSecr=61222
368,57.336879,10.0.0.3,10.0.0.2,TCP,2962,40758 > 34568 [ACK] Seq=499297 Ack=1 Win=29696 Len=2896 TSval=61261 TSecr=61236
369,57.343106,10.0.0.2,10.0.0.3,TCP,66,34568 > 40758 [ACK] Seq=1 Ack=484817 Win=299008 Len=0 TSval=61315 TSecr=61228
370,57.348688,10.0.0.3,10.0.0.2,TCP,1514,40758 > 34568 [ACK] Seq=502193 Ack=1 Win=29696 Len=1448 TSval=61265 TSecr=61240
371,57.362289,10.0.0.2,10.0.0.3,TCP,66,34568 > 40758 [ACK] Seq=1 Ack=486265 Win=301568 Len=0 TSval=61320 TSecr=61231
372,57.373017,10.0.0.3,10.0.0.2,TCP,2962,40758 > 34568 [ACK] Seq=503641 Ack=1 Win=29696 Len=2896 TSval=61272 TSecr=61247
373,57.377838,10.0.0.2,10.0.0.3,TCP,66,34568 > 40758 [ACK] Seq=1 Ack=489161 Win=307712 Len=0 TSval=61324 TSecr=61237
374,57.39746,10.0.0.3,10.0.0.2,TCP,2962,40758 > 34568 [ACK] Seq=506537 Ack=1 Win=29696 Len=2896 TSval=61277 TSecr=61252
375,57.397475,10.0.0.2,10.0.0.3,TCP,66,34568 > 40758 [ACK] Seq=1 Ack=490609 Win=310272 Len=0 TSval=61329 TSecr=61241
376,57.409251,10.0.0.3,10.0.0.2,TCP,1514,40758 > 34568 [ACK] Seq=509433 Ack=1 Win=29696 Len=1448 TSval=61281 TSecr=61256
377,57.415126,10.0.0.2,10.0.0.3,TCP,66,34568 > 40758 [ACK] Seq=1 Ack=493505 Win=316416 Len=0 TSval=61333 TSecr=61247
378,57.434351,10.0.0.3,10.0.0.2,TCP,2962,40758 > 34568 [ACK] Seq=510881 Ack=1 Win=29696 Len=2896 TSval=61286 TSecr=61261
379,57.439395,10.0.0.2,10.0.0.3,TCP,66,34568 > 40758 [ACK] Seq=1 Ack=496401 Win=322048 Len=0 TSval=61339 TSecr=61252
380,57.457941,10.0.0.3,10.0.0.2,TCP,2962,40758 > 34568 [ACK] Seq=513777 Ack=1 Win=29696 Len=2896 TSval=61292 TSecr=61267
381,57.463811,10.0.0.2,10.0.0.3,TCP,66,34568 > 40758 [ACK] Seq=1 Ack=499297 Win=327680 Len=0 TSval=61345 TSecr=61256
382,57.469818,10.0.0.3,10.0.0.2,TCP,1514,40758 > 34568 [ACK] Seq=516673 Ack=1 Win=29696 Len=1448 TSval=61292 TSecr=61267
383,57.487363,10.0.0.2,10.0.0.3,TCP,66,34568 > 40758 [ACK] Seq=1 Ack=502193 Win=333824 Len=0 TSval=61351 TSecr=61261
384,57.494049,10.0.0.3,10.0.0.2,TCP,2962,40758 > 34568 [ACK] Seq=518121 Ack=1 Win=29696 Len=2896 TSval=61298 TSecr=61273
385,57.506479,10.0.0.2,10.0.0.3,TCP,66,34568 > 40758 [ACK] Seq=1 Ack=503641 Win=336384 Len=0 TSval=61356 TSecr=61265
386,57.518475,10.0.0.3,10.0.0.2,TCP,2962,40758 > 34568 [ACK] Seq=521017 Ack=1 Win=29696 Len=2896 TSval=61304 TSecr=61279
387,57.524332,10.0.0.2,10.0.0.3,TCP,66,34568 > 40758 [ACK] Seq=1 Ack=506537 Win=342528 Len=0 TSval=61361 TSecr=61272
388,57.542879,10.0.0.3,10.0.0.2,TCP,2962,40758 > 34568 [ACK] Seq=523913 Ack=1 Win=29696 Len=2896 TSval=61310 TSecr=61285
389,57.547998,10.0.0.2,10.0.0.3,TCP,66,34568 > 40758 [ACK] Seq=1 Ack=509433 Win=348160 Len=0 TSval=61367 TSecr=61277
390,57.567152,10.0.0.3,10.0.0.2,TCP,2962,40758 > 34568 [ACK] Seq=526809 Ack=1 Win=29696 Len=2896 TSval=61316 TSecr=61291
391,57.567172,10.0.0.2,10.0.0.3,TCP,66,34568 > 40758 [ACK] Seq=1 Ack=510881 Win=350720 Len=0 TSval=61371 TSecr=61281
392,57.5852,10.0.0.2,10.0.0.3,TCP,66,34568 > 40758 [ACK] Seq=1 Ack=513777 Win=356864 Len=0 TSval=61376 TSecr=61286
393,57.591036,10.0.0.3,10.0.0.2,TCP,2962,40758 > 34568 [ACK] Seq=529705 Ack=1 Win=29696 Len=2896 TSval=61322 TSecr=61297
394,57.609069,10.0.0.2,10.0.0.3,TCP,66,34568 > 40758 [ACK] Seq=1 Ack=516673 Win=362496 Len=0 TSval=61382 TSecr=61292
395,57.615316,10.0.0.3,10.0.0.2,TCP,2962,40758 > 34568 [ACK] Seq=532601 Ack=1 Win=29696 Len=2896 TSval=61328 TSecr=61303
396,57.627257,10.0.0.3,10.0.0.2,TCP,1514,40758 > 34568 [ACK] Seq=535497 Ack=1 Win=29696 Len=1448 TSval=61328 TSecr=61303
397,57.62794,10.0.0.2,10.0.0.3,TCP,66,34568 > 40758 [ACK] Seq=1 Ack=518121 Win=365568 Len=0 TSval=61386 TSecr=61292
398,57.645321,10.0.0.2,10.0.0.3,TCP,66,34568 > 40758 [ACK] Seq=1 Ack=521017 Win=371200 Len=0 TSval=61391 TSecr=61298
399,57.651467,10.0.0.3,10.0.0.2,TCP,2962,40758 > 34568 [ACK] Seq=536945 Ack=1 Win=29696 Len=2896 TSval=61334 TSecr=61309
400,57.663867,10.0.0.3,10.0.0.2,TCP,1513,"40758 > 34568 [FIN, PSH, ACK] Seq=539841 Ack=1 Win=29696 Len=1447 TSval=61334 TSecr=61309"
401,57.669762,10.0.0.2,10.0.0.3,TCP,66,34568 > 40758 [ACK] Seq=1 Ack=523913 Win=376832 Len=0 TSval=61397 TSecr=61304
402,57.694082,10.0.0.2,10.0.0.3,TCP,66,34568 > 40758 [ACK] Seq=1 Ack=526809 Win=382976 Len=0 TSval=61403 TSecr=61310
403,57.717913,10.0.0.2,10.0.0.3,TCP,66,34568 > 40758 [ACK] Seq=1 Ack=529705 Win=388608 Len=0 TSval=61409 TSecr=61316
404,57.742306,10.0.0.2,10.0.0.3,TCP,66,34568 > 40758 [ACK] Seq=1 Ack=532601 Win=394240 Len=0 TSval=61415 TSecr=61322
405,57.766338,10.0.0.2,10.0.0.3,TCP,66,34568 > 40758 [ACK] Seq=1 Ack=535497 Win=400384 Len=0 TSval=61421 TSecr=61328
406,57.785319,10.0.0.2,10.0.0.3,TCP,66,34568 > 40758 [ACK] Seq=1 Ack=536945 Win=402944 Len=0 TSval=61426 TSecr=61328
407,57.804426,10.0.0.2,10.0.0.3,TCP,66,34568 > 40758 [ACK] Seq=1 Ack=539841 Win=409088 Len=0 TSval=61430 TSecr=61334
408,57.822009,10.0.0.2,10.0.0.3,TCP,66,"34568 > 40758 [FIN, ACK] Seq=1 Ack=541289 Win=411648 Len=0 TSval=61435 TSecr=61334"
409,57.872769,10.0.0.3,10.0.0.2,TCP,66,40758 > 34568 [ACK] Seq=541289 Ack=2 Win=29696 Len=0 TSval=61460 TSecr=61435
